{
  "$schema": "https://json-schema.org/draft/2020-12/schema",
  "$id": "https://caseloop.dev/contracts/v4/schemas/controller-registration.schema.json",
  "title": "CaseLoop ControllerRegistration",
  "description": "Frozen control-plane service identity and command allowlist. This is a trust root record and therefore does not recursively carry an AuthorityReceipt.",
  "type": "object",
  "required": [
    "schema_version",
    "controller_registration_id",
    "revision",
    "previous_snapshot",
    "state",
    "workspace_id",
    "owner",
    "controller_principal",
    "principal_type",
    "allowed_commands",
    "ownership_contract",
    "event_catalog",
    "valid_from",
    "expires_at",
    "service_identity_digest",
    "registered_by_human_principal",
    "registration_audit_ref",
    "registered_at",
    "immutable",
    "hash_rule",
    "registration_digest"
  ],
  "properties": {
    "schema_version": {"$ref": "https://caseloop.dev/contracts/v4/schemas/common-defs.schema.json#/$defs/schema_version"},
    "controller_registration_id": {"$ref": "https://caseloop.dev/contracts/v4/schemas/common-defs.schema.json#/$defs/controller_registration_id"},
    "revision": {"type": "integer", "minimum": 1},
    "previous_snapshot": {
      "oneOf": [
        {"$ref": "https://caseloop.dev/contracts/v4/schemas/common-defs.schema.json#/$defs/exact_record_binding"},
        {"type": "null"}
      ]
    },
    "state": {"enum": ["ACTIVE", "REVOKED", "EXPIRED"]},
    "workspace_id": {"$ref": "https://caseloop.dev/contracts/v4/schemas/common-defs.schema.json#/$defs/workspace_id"},
    "owner": {"type": "string", "pattern": "^[a-z][a-z0-9-]{2,63}$"},
    "controller_principal": {"$ref": "https://caseloop.dev/contracts/v4/schemas/common-defs.schema.json#/$defs/principal_id"},
    "principal_type": {"const": "CONTROLLER_SERVICE"},
    "allowed_commands": {
      "type": "array",
      "items": {"$ref": "https://caseloop.dev/contracts/v4/schemas/common-defs.schema.json#/$defs/intent_name"},
      "minItems": 1,
      "uniqueItems": true
    },
    "ownership_contract": {
      "type": "object",
      "required": ["version", "digest"],
      "properties": {
        "version": {"const": "1.0"},
        "digest": {"$ref": "https://caseloop.dev/contracts/v4/schemas/common-defs.schema.json#/$defs/digest"}
      },
      "additionalProperties": false
    },
    "event_catalog": {
      "type": "object",
      "required": ["version", "digest"],
      "properties": {
        "version": {"const": "1.0"},
        "digest": {"$ref": "https://caseloop.dev/contracts/v4/schemas/common-defs.schema.json#/$defs/digest"}
      },
      "additionalProperties": false
    },
    "valid_from": {"$ref": "https://caseloop.dev/contracts/v4/schemas/common-defs.schema.json#/$defs/date_time"},
    "expires_at": {
      "oneOf": [
        {"$ref": "https://caseloop.dev/contracts/v4/schemas/common-defs.schema.json#/$defs/date_time"},
        {"type": "null"}
      ]
    },
    "service_identity_digest": {"$ref": "https://caseloop.dev/contracts/v4/schemas/common-defs.schema.json#/$defs/digest"},
    "registered_by_human_principal": {"$ref": "https://caseloop.dev/contracts/v4/schemas/common-defs.schema.json#/$defs/principal_id"},
    "registration_audit_ref": {"$ref": "https://caseloop.dev/contracts/v4/schemas/common-defs.schema.json#/$defs/audit_ref"},
    "registered_at": {"$ref": "https://caseloop.dev/contracts/v4/schemas/common-defs.schema.json#/$defs/date_time"},
    "immutable": {"const": true},
    "hash_rule": {"const": "jcs-rfc8785-v1+sha256(excluding:/registration_digest)"},
    "registration_digest": {"$ref": "https://caseloop.dev/contracts/v4/schemas/common-defs.schema.json#/$defs/digest"}
  },
  "allOf": [
    {
      "if": {"properties": {"revision": {"const": 1}}, "required": ["revision"]},
      "then": {"properties": {"previous_snapshot": {"type": "null"}}},
      "else": {"properties": {"previous_snapshot": {"type": "object"}}}
    }
  ],
  "additionalProperties": false
}
