{
  "schema_version": "1.0",
  "controller_registration_id": "creg_proposalcontroller",
  "revision": 1,
  "previous_snapshot": null,
  "state": "ACTIVE",
  "workspace_id": "ws_stage0001",
  "owner": "proposal-controller",
  "controller_principal": "prn_proposalctl",
  "principal_type": "CONTROLLER_SERVICE",
  "allowed_commands": [
    "candidate-contracts.freeze",
    "candidate-revisions.record",
    "intents.submit",
    "proposals.decide",
    "proposals.submit"
  ],
  "ownership_contract": {
    "version": "1.0",
    "digest": "sha256:479e3501d7b76a006864e634269a9018c8f3d6da90547b152e95c627180f848d"
  },
  "event_catalog": {
    "version": "1.0",
    "digest": "sha256:01b8a4e1f8328060d6bfdf77fe057f5eb1740d1334ced3560365a59396cb8611"
  },
  "valid_from": "2026-08-10T00:00:00Z",
  "expires_at": null,
  "service_identity_digest": "sha256:bd9cb133e1af9abe575c817e626bff94a61d2a3c8dfaecf04f408e35bae34f35",
  "registered_by_human_principal": "prn_platformadmin",
  "registration_audit_ref": "audit://aud_proposalcontroller",
  "registered_at": "2026-08-10T00:00:00Z",
  "immutable": true,
  "hash_rule": "jcs-rfc8785-v1+sha256(excluding:/registration_digest)",
  "registration_digest": "sha256:316123ab316ac1eecfd2b8268ae745bf85aaa5717fb7496361bd04fb80677a99"
}
