{
  "schema_version": "1.0",
  "controller_registration_id": "creg_manifestcontroller",
  "revision": 1,
  "previous_snapshot": null,
  "state": "ACTIVE",
  "workspace_id": "ws_stage0001",
  "owner": "manifest-controller",
  "controller_principal": "prn_manifestctl1",
  "principal_type": "CONTROLLER_SERVICE",
  "allowed_commands": [
    "agent-manifests.register"
  ],
  "ownership_contract": {
    "version": "1.0",
    "digest": "sha256:479e3501d7b76a006864e634269a9018c8f3d6da90547b152e95c627180f848d"
  },
  "event_catalog": {
    "version": "1.0",
    "digest": "sha256:01b8a4e1f8328060d6bfdf77fe057f5eb1740d1334ced3560365a59396cb8611"
  },
  "valid_from": "2026-08-10T00:00:00Z",
  "expires_at": null,
  "service_identity_digest": "sha256:b8a82ddd16a828a49971ebd62ec89e095d9901b124a4e49bfcabb285cc9dd97d",
  "registered_by_human_principal": "prn_platformadmin",
  "registration_audit_ref": "audit://aud_manifestcontroller",
  "registered_at": "2026-08-10T00:00:00Z",
  "immutable": true,
  "hash_rule": "jcs-rfc8785-v1+sha256(excluding:/registration_digest)",
  "registration_digest": "sha256:fe1f75c89d4cdf5221a04942cbee1999477782281b71910e1e9a73afe06b1bf1"
}
