{
  "schema_version": "1.0",
  "controller_registration_id": "creg_workcontroller",
  "revision": 1,
  "previous_snapshot": null,
  "state": "ACTIVE",
  "workspace_id": "ws_stage0001",
  "owner": "work-controller",
  "controller_principal": "prn_workcontrol1",
  "principal_type": "CONTROLLER_SERVICE",
  "allowed_commands": [
    "attempts.cancel",
    "attempts.complete",
    "attempts.fail",
    "attempts.mark-unknown",
    "attempts.reconcile",
    "attempts.record-receipt",
    "attempts.start",
    "participation-manifests.freeze",
    "work.cancel-request",
    "work.claim",
    "work.exhaust",
    "work.heartbeat",
    "work.request"
  ],
  "ownership_contract": {
    "version": "1.0",
    "digest": "sha256:d3c2a13be884566c2e033f293e7ffad440d5dbd987f969a5e1285631436dc85f"
  },
  "event_catalog": {
    "version": "1.0",
    "digest": "sha256:b57be63e8c976f309905d4a56cbdeec775fd73f87bd25312aee140b7372cee49"
  },
  "valid_from": "2026-08-10T00:00:00Z",
  "expires_at": null,
  "service_identity_digest": "sha256:840a7fa931f3794342863af8b6ed9241b94b04374e7015523675da2b56c3c16f",
  "registered_by_human_principal": "prn_platformadmin",
  "registration_audit_ref": "audit://aud_workcontroller",
  "registered_at": "2026-08-10T00:00:00Z",
  "immutable": true,
  "hash_rule": "jcs-rfc8785-v1+sha256(excluding:/registration_digest)",
  "registration_digest": "sha256:792870727ee2dd43c18a632c970ebe0782adced0571bef87ad6636ab458bfa31"
}
