{
  "schema_version": "1.0",
  "controller_registration_id": "creg_skillregistrycontroller",
  "revision": 1,
  "previous_snapshot": null,
  "state": "ACTIVE",
  "workspace_id": "ws_stage0001",
  "owner": "skill-registry-controller",
  "controller_principal": "prn_skillregistry",
  "principal_type": "CONTROLLER_SERVICE",
  "allowed_commands": [
    "skill-manifests.register"
  ],
  "ownership_contract": {
    "version": "1.0",
    "digest": "sha256:d3c2a13be884566c2e033f293e7ffad440d5dbd987f969a5e1285631436dc85f"
  },
  "event_catalog": {
    "version": "1.0",
    "digest": "sha256:b57be63e8c976f309905d4a56cbdeec775fd73f87bd25312aee140b7372cee49"
  },
  "valid_from": "2026-08-10T00:00:00Z",
  "expires_at": null,
  "service_identity_digest": "sha256:178dc45dc5b048902a236bb68b30de93e0f90637059d1a1eea02efeb2b15edbf",
  "registered_by_human_principal": "prn_platformadmin",
  "registration_audit_ref": "audit://aud_skillregistrycontroller",
  "registered_at": "2026-08-10T00:00:00Z",
  "immutable": true,
  "hash_rule": "jcs-rfc8785-v1+sha256(excluding:/registration_digest)",
  "registration_digest": "sha256:c5efeb5a070a39d1cda4a9b021ef8b08df1d60449a4d09de91305c1cb9555261"
}
